{"$id":"https://github.com/rdemb/delta-witness/research/DW-001/schema/claim-relevant-path-divergence-catalog.schema.json","$schema":"https://json-schema.org/draft/2020-12/schema","additionalProperties":false,"properties":{"catalog_sha256":{"const":"f36fbe58c00cfb8ed0fd994f3bb1dcdb45040774f7ae4663563b9f40ac15daa5"},"implementations":{"items":false,"maxItems":8,"minItems":8,"prefixItems":[{"additionalProperties":false,"properties":{"ast_sha256":{"const":"c29b6b7ea3bdc6b8eb318c1f9d98dbd660dfccada493e51c7f889c97d8b13df6"},"compile_valid":{"const":true},"duplicate_of":{"const":null},"implementation_id":{"const":"direct-role-inversion-v1"},"implementation_sha256":{"const":"43392ae23b73112831715e5d1df3441316b8369e2e2e75004f507899befcebb5"},"order":{"const":1},"role":{"const":"claim_relevant_route_fault"},"source_body_in_artifact":{"const":false},"source_sha256":{"const":"980ff8e3a8ab0883eba3f3067a4f2d8bff7b874a5ec853a308c1d59556c79f67"},"status":{"const":"generated"}},"required":["order","implementation_id","role","status","implementation_sha256","duplicate_of","source_sha256","ast_sha256","compile_valid","source_body_in_artifact"],"type":"object"},{"additionalProperties":false,"properties":{"ast_sha256":{"const":"c49054376c4afdd85b50c559aa46a11b5e689b50c9e88f7cc8f61285a5a94609"},"compile_valid":{"const":true},"duplicate_of":{"const":null},"implementation_id":{"const":"verbose-via-compact-collateral-diversion-v1"},"implementation_sha256":{"const":"9b701240f9424157f268ef20ed2c9a7abe8490cb2e71fdb2acfb4ebe90be6a5f"},"order":{"const":2},"role":{"const":"collateral_route_fault"},"source_body_in_artifact":{"const":false},"source_sha256":{"const":"7f17b742ea97d5c63d9a41c3c551c52135b278afa8f2e948dd41217df4eb4b4b"},"status":{"const":"generated"}},"required":["order","implementation_id","role","status","implementation_sha256","duplicate_of","source_sha256","ast_sha256","compile_valid","source_body_in_artifact"],"type":"object"},{"additionalProperties":false,"properties":{"ast_sha256":{"const":"b6a3f50603de8d8218f7b2c52a3d4f6d2b1f8110e9a6f76c6e5abfa29fd191f1"},"compile_valid":{"const":true},"duplicate_of":{"const":null},"implementation_id":{"const":"shared-or-gates-v1"},"implementation_sha256":{"const":"f7c201e89699bbcb9f75a4f4f276c21960983d62a258de928895312ff77e385e"},"order":{"const":3},"role":{"const":"shared_claim_fault"},"source_body_in_artifact":{"const":false},"source_sha256":{"const":"8db8d4bc75655212c462aff64ae1e609e7e7c2d96e4287893d2b9dc0ee8eea42"},"status":{"const":"generated"}},"required":["order","implementation_id","role","status","implementation_sha256","duplicate_of","source_sha256","ast_sha256","compile_valid","source_body_in_artifact"],"type":"object"},{"additionalProperties":false,"properties":{"ast_sha256":{"const":"575f9a1f61e06908e6fa6a70b320bfbfeea1a1279db6a5b997b7701dceb20b0d"},"compile_valid":{"const":true},"duplicate_of":{"const":null},"implementation_id":{"const":"direct-via-normalized-neutral-diversion-v1"},"implementation_sha256":{"const":"902fd9e23fb3668c69b211dcb61fbd935e6e5ac846188308853ebd57270e7b15"},"order":{"const":4},"role":{"const":"neutral_path_diversion"},"source_body_in_artifact":{"const":false},"source_sha256":{"const":"84bb5cbc52d5b6dc70da53ad33d2e509fe9956465bc61f3a971dbf3e0f8d794c"},"status":{"const":"generated_behavior_preserving_control"}},"required":["order","implementation_id","role","status","implementation_sha256","duplicate_of","source_sha256","ast_sha256","compile_valid","source_body_in_artifact"],"type":"object"},{"additionalProperties":false,"properties":{"ast_sha256":{"const":"b6a3f50603de8d8218f7b2c52a3d4f6d2b1f8110e9a6f76c6e5abfa29fd191f1"},"compile_valid":{"const":true},"duplicate_of":{"const":"f7c201e89699bbcb9f75a4f4f276c21960983d62a258de928895312ff77e385e"},"implementation_id":{"const":"duplicate-shared-or-control-v1"},"implementation_sha256":{"const":"2671bea445506c1b4b2e9fb202a154b8c7afbe13181d71b9f2120b6d9207187d"},"order":{"const":5},"role":{"const":"duplicate_control"},"source_body_in_artifact":{"const":false},"source_sha256":{"const":"8db8d4bc75655212c462aff64ae1e609e7e7c2d96e4287893d2b9dc0ee8eea42"},"status":{"const":"duplicate"}},"required":["order","implementation_id","role","status","implementation_sha256","duplicate_of","source_sha256","ast_sha256","compile_valid","source_body_in_artifact"],"type":"object"},{"additionalProperties":false,"properties":{"ast_sha256":{"const":null},"compile_valid":{"const":null},"duplicate_of":{"const":null},"implementation_id":{"const":"not-applicable-addition-control-v1"},"implementation_sha256":{"const":"c5bbfb01d5aa57ab1d4f3e2fbc342e17a5cf35a52f1e8b2cdf94c3845f1cfc4b"},"order":{"const":6},"role":{"const":"not_applicable_control"},"source_body_in_artifact":{"const":false},"source_sha256":{"const":null},"status":{"const":"not_applicable"}},"required":["order","implementation_id","role","status","implementation_sha256","duplicate_of","source_sha256","ast_sha256","compile_valid","source_body_in_artifact"],"type":"object"},{"additionalProperties":false,"properties":{"ast_sha256":{"const":null},"compile_valid":{"const":false},"duplicate_of":{"const":null},"implementation_id":{"const":"invalid-render-control-v1"},"implementation_sha256":{"const":"982f062df4932d113c9c10ff1386647e317d196afecd93892f86012d3f14fd8b"},"order":{"const":7},"role":{"const":"invalid_control"},"source_body_in_artifact":{"const":false},"source_sha256":{"const":"71ee15181b30cd5c63ff43ef67e78769ff2e998e018deb21957fea1abaeea624"},"status":{"const":"invalid"}},"required":["order","implementation_id","role","status","implementation_sha256","duplicate_of","source_sha256","ast_sha256","compile_valid","source_body_in_artifact"],"type":"object"},{"additionalProperties":false,"properties":{"ast_sha256":{"const":"cbbd854dc81acd5a2a31a597f8e7a6d05e283bfc0b7b52ed4550f1a37fb3612d"},"compile_valid":{"const":true},"duplicate_of":{"const":null},"implementation_id":{"const":"equivalent-review-copy-return-v1"},"implementation_sha256":{"const":"c14e9dd74699c8bbb813fc318126d8bbd4b6fc395c8dd5e3de7546de9bda63e2"},"order":{"const":8},"role":{"const":"equivalent_review_control"},"source_body_in_artifact":{"const":false},"source_sha256":{"const":"4c0d8e58fe6d947361fb81d8a17bcce6f7ee3051790c5b389ff8453a7f5ae773"},"status":{"const":"equivalent_review_required"}},"required":["order","implementation_id","role","status","implementation_sha256","duplicate_of","source_sha256","ast_sha256","compile_valid","source_body_in_artifact"],"type":"object"}],"type":"array"},"partition":{"const":"development"},"plan_id":{"const":"DW-001-CLAIM-RELEVANT-PATH-DIVERGENCE-PLAN-V1"},"plan_sha256":{"const":"ff0403132c3424fc7309a15a05794eed93ac9eb526de172e17326f8409ca0888"},"schema_version":{"const":"deltawitness.dw001-claim-relevant-path-divergence-catalog.v1"},"source":{"additionalProperties":false,"properties":{"ast_sha256":{"const":"dabb7011748968f8d43d590ff843a91697a3344a2400d7cabaf926b79ca88e2d"},"path":{"const":"src/access.py"},"source_body_in_artifact":{"const":false},"source_id":{"const":"claim-relevant-path-authorization-candidate-v1"},"source_line_count":{"const":23},"source_sha256":{"const":"8c1bdd26c2e98cd209f210630bfe4d274a3dcd7bbd042db8b8586c7750814327"},"symbol":{"const":"authorize"}},"required":["source_id","path","symbol","source_sha256","ast_sha256","source_line_count","source_body_in_artifact"],"type":"object"},"study_id":{"const":"DW-001"},"summary":{"additionalProperties":false,"properties":{"duplicate":{"const":1},"equivalent_review_required":{"const":1},"generated":{"const":3},"generated_behavior_preserving_control":{"const":1},"invalid":{"const":1},"not_applicable":{"const":1},"score":{"const":null},"total_records":{"const":8}},"required":["total_records","generated","generated_behavior_preserving_control","duplicate","not_applicable","invalid","equivalent_review_required","score"],"type":"object"},"test":{"additionalProperties":false,"properties":{"claim_selector_count":{"const":8},"collateral_reference_selector_count":{"const":8},"path":{"const":"tests/test_access.py"},"test_body_in_artifact":{"const":false},"test_id":{"const":"claim-relevant-path-selectors-v1"},"test_sha256":{"const":"8a26d52fa7fbb4ab7fc6eab466d9051cd329b0da09a667b5e220fbbfd416d1e9"},"total_selector_count":{"const":16}},"required":["test_id","path","test_sha256","claim_selector_count","collateral_reference_selector_count","total_selector_count","test_body_in_artifact"],"type":"object"}},"required":["schema_version","study_id","plan_id","plan_sha256","partition","source","test","implementations","summary","catalog_sha256"],"title":"DeltaWitness DW-001 Claim-Relevant Path Divergence Catalog v1","type":"object"}
