{"catalog_sha256":"f36fbe58c00cfb8ed0fd994f3bb1dcdb45040774f7ae4663563b9f40ac15daa5","implementations":[{"ast_sha256":"c29b6b7ea3bdc6b8eb318c1f9d98dbd660dfccada493e51c7f889c97d8b13df6","compile_valid":true,"duplicate_of":null,"implementation_id":"direct-role-inversion-v1","implementation_sha256":"43392ae23b73112831715e5d1df3441316b8369e2e2e75004f507899befcebb5","order":1,"role":"claim_relevant_route_fault","source_body_in_artifact":false,"source_sha256":"980ff8e3a8ab0883eba3f3067a4f2d8bff7b874a5ec853a308c1d59556c79f67","status":"generated"},{"ast_sha256":"c49054376c4afdd85b50c559aa46a11b5e689b50c9e88f7cc8f61285a5a94609","compile_valid":true,"duplicate_of":null,"implementation_id":"verbose-via-compact-collateral-diversion-v1","implementation_sha256":"9b701240f9424157f268ef20ed2c9a7abe8490cb2e71fdb2acfb4ebe90be6a5f","order":2,"role":"collateral_route_fault","source_body_in_artifact":false,"source_sha256":"7f17b742ea97d5c63d9a41c3c551c52135b278afa8f2e948dd41217df4eb4b4b","status":"generated"},{"ast_sha256":"b6a3f50603de8d8218f7b2c52a3d4f6d2b1f8110e9a6f76c6e5abfa29fd191f1","compile_valid":true,"duplicate_of":null,"implementation_id":"shared-or-gates-v1","implementation_sha256":"f7c201e89699bbcb9f75a4f4f276c21960983d62a258de928895312ff77e385e","order":3,"role":"shared_claim_fault","source_body_in_artifact":false,"source_sha256":"8db8d4bc75655212c462aff64ae1e609e7e7c2d96e4287893d2b9dc0ee8eea42","status":"generated"},{"ast_sha256":"575f9a1f61e06908e6fa6a70b320bfbfeea1a1279db6a5b997b7701dceb20b0d","compile_valid":true,"duplicate_of":null,"implementation_id":"direct-via-normalized-neutral-diversion-v1","implementation_sha256":"902fd9e23fb3668c69b211dcb61fbd935e6e5ac846188308853ebd57270e7b15","order":4,"role":"neutral_path_diversion","source_body_in_artifact":false,"source_sha256":"84bb5cbc52d5b6dc70da53ad33d2e509fe9956465bc61f3a971dbf3e0f8d794c","status":"generated_behavior_preserving_control"},{"ast_sha256":"b6a3f50603de8d8218f7b2c52a3d4f6d2b1f8110e9a6f76c6e5abfa29fd191f1","compile_valid":true,"duplicate_of":"f7c201e89699bbcb9f75a4f4f276c21960983d62a258de928895312ff77e385e","implementation_id":"duplicate-shared-or-control-v1","implementation_sha256":"2671bea445506c1b4b2e9fb202a154b8c7afbe13181d71b9f2120b6d9207187d","order":5,"role":"duplicate_control","source_body_in_artifact":false,"source_sha256":"8db8d4bc75655212c462aff64ae1e609e7e7c2d96e4287893d2b9dc0ee8eea42","status":"duplicate"},{"ast_sha256":null,"compile_valid":null,"duplicate_of":null,"implementation_id":"not-applicable-addition-control-v1","implementation_sha256":"c5bbfb01d5aa57ab1d4f3e2fbc342e17a5cf35a52f1e8b2cdf94c3845f1cfc4b","order":6,"role":"not_applicable_control","source_body_in_artifact":false,"source_sha256":null,"status":"not_applicable"},{"ast_sha256":null,"compile_valid":false,"duplicate_of":null,"implementation_id":"invalid-render-control-v1","implementation_sha256":"982f062df4932d113c9c10ff1386647e317d196afecd93892f86012d3f14fd8b","order":7,"role":"invalid_control","source_body_in_artifact":false,"source_sha256":"71ee15181b30cd5c63ff43ef67e78769ff2e998e018deb21957fea1abaeea624","status":"invalid"},{"ast_sha256":"cbbd854dc81acd5a2a31a597f8e7a6d05e283bfc0b7b52ed4550f1a37fb3612d","compile_valid":true,"duplicate_of":null,"implementation_id":"equivalent-review-copy-return-v1","implementation_sha256":"c14e9dd74699c8bbb813fc318126d8bbd4b6fc395c8dd5e3de7546de9bda63e2","order":8,"role":"equivalent_review_control","source_body_in_artifact":false,"source_sha256":"4c0d8e58fe6d947361fb81d8a17bcce6f7ee3051790c5b389ff8453a7f5ae773","status":"equivalent_review_required"}],"partition":"development","plan_id":"DW-001-CLAIM-RELEVANT-PATH-DIVERGENCE-PLAN-V1","plan_sha256":"ff0403132c3424fc7309a15a05794eed93ac9eb526de172e17326f8409ca0888","schema_version":"deltawitness.dw001-claim-relevant-path-divergence-catalog.v1","source":{"ast_sha256":"dabb7011748968f8d43d590ff843a91697a3344a2400d7cabaf926b79ca88e2d","path":"src/access.py","source_body_in_artifact":false,"source_id":"claim-relevant-path-authorization-candidate-v1","source_line_count":23,"source_sha256":"8c1bdd26c2e98cd209f210630bfe4d274a3dcd7bbd042db8b8586c7750814327","symbol":"authorize"},"study_id":"DW-001","summary":{"duplicate":1,"equivalent_review_required":1,"generated":3,"generated_behavior_preserving_control":1,"invalid":1,"not_applicable":1,"score":null,"total_records":8},"test":{"claim_selector_count":8,"collateral_reference_selector_count":8,"path":"tests/test_access.py","test_body_in_artifact":false,"test_id":"claim-relevant-path-selectors-v1","test_sha256":"8a26d52fa7fbb4ab7fc6eab466d9051cd329b0da09a667b5e220fbbfd416d1e9","total_selector_count":16}}
